[
  {
    "id": 1,
    "judgment_name": "174.pdf",
    "query": "Tranh chấp bồi thường thiệt hại ngoài hợp đồng do công chứng viên thiếu trách nhiệm.",
    "ground_truth": {
      "core": [
        {
          "law_code": "luat_cong_chung_2014",
          "article": "Điều 38",
          "reasoning": "Adjudicated decisive legal basis (luat_cong_chung_2014 - Điều 38) for resolving the dispute.",
          "importance": "decisive",
          "importance_score": 3,
          "source_type": "explicit",
          "domain": "substantive"
        },
        {
          "law_code": "luat_cong_chung_2014",
          "article": "Điều 40",
          "reasoning": "Adjudicated decisive legal basis (luat_cong_chung_2014 - Điều 40) for resolving the dispute.",
          "importance": "decisive",
          "importance_score": 3,
          "source_type": "explicit",
          "domain": "substantive"
        }
      ],
      "supporting": [
        {
          "law_code": "bo_luat_to_tung_dan_su_2015",
          "article": "Điều 337",
          "reasoning": "Adjudicated supporting legal basis (bo_luat_to_tung_dan_su_2015 - Điều 337) providing secondary context.",
          "importance": "supporting",
          "importance_score": 1,
          "source_type": "explicit",
          "domain": "procedural"
        },
        {
          "law_code": "bo_luat_dan_su_2005",
          "article": "Điều 617",
          "reasoning": "Adjudicated supporting legal basis (bo_luat_dan_su_2005 - Điều 617) providing secondary context.",
          "importance": "supporting",
          "importance_score": 1,
          "source_type": "explicit",
          "domain": "substantive"
        }
      ]
    }
  },
  {
    "id": 2,
    "judgment_name": "175.pdf",
    "query": "Tranh chấp đòi lại quyền sử dụng đất và tài sản.",
    "ground_truth": {
      "core": [
        {
          "law_code": "bo_luat_dan_su_2015",
          "article": "Điều 117",
          "reasoning": "Adjudicated decisive legal basis (bo_luat_dan_su_2015 - Điều 117) for resolving the dispute.",
          "importance": "decisive",
          "importance_score": 3,
          "source_type": "inferred",
          "domain": "substantive"
        }
      ],
      "supporting": []
    }
  },
  {
    "id": 3,
    "judgment_name": "217.pdf",
    "query": "Tranh chấp hợp đồng đặt cọc mua bán nhà ở.",
    "ground_truth": {
      "core": [
        {
          "law_code": "bo_luat_dan_su_2015",
          "article": "Điều 328",
          "reasoning": "Adjudicated decisive legal basis (bo_luat_dan_su_2015 - Điều 328) for resolving the dispute.",
          "importance": "decisive",
          "importance_score": 3,
          "source_type": "inferred",
          "domain": "substantive"
        }
      ],
      "supporting": [
        {
          "law_code": "bo_luat_to_tung_dan_su_2015",
          "article": "Điều 85",
          "reasoning": "Adjudicated supporting legal basis (bo_luat_to_tung_dan_su_2015 - Điều 85) providing secondary context.",
          "importance": "supporting",
          "importance_score": 1,
          "source_type": "inferred",
          "domain": "procedural"
        }
      ]
    }
  }
]